{
  "$schema": "https://json-schema.org/draft/2020-12/schema",
  "type": "object",
  "additionalProperties": false,
  "properties": {
    "domain": {
      "type": "object",
      "additionalProperties": false,
      "properties": {
        "id": {
          "type": "string",
          "minLength": 1
        },
        "name": {
          "type": "string",
          "minLength": 1
        }
      },
      "required": [
        "id",
        "name"
      ]
    },
    "vocabulary": {
      "type": "object",
      "additionalProperties": false,
      "properties": {
        "customer": {
          "type": "string",
          "minLength": 1
        },
        "unit": {
          "type": "string",
          "minLength": 1
        },
        "operator": {
          "type": "string",
          "minLength": 1
        },
        "case": {
          "type": "string",
          "minLength": 1
        },
        "location_levels": {
          "type": "array",
          "items": {
            "type": "string",
            "minLength": 1
          },
          "minItems": 1
        }
      },
      "required": [
        "customer",
        "unit",
        "operator",
        "case",
        "location_levels"
      ]
    },
    "service_categories": {
      "type": "array",
      "minItems": 1,
      "items": {
        "type": "object",
        "additionalProperties": false,
        "properties": {
          "code": {
            "type": "string",
            "minLength": 1
          },
          "name": {
            "type": "string",
            "minLength": 1
          },
          "department": {
            "type": "string",
            "minLength": 1
          }
        },
        "required": [
          "code",
          "name",
          "department"
        ]
      }
    },
    "case_stages": {
      "type": "array",
      "minItems": 1,
      "items": {
        "type": "object",
        "additionalProperties": false,
        "properties": {
          "code": {
            "type": "string",
            "minLength": 1
          },
          "name": {
            "type": "string",
            "minLength": 1
          },
          "actor": {
            "enum": [
              "agent",
              "customer",
              "management",
              "staff",
              "system"
            ]
          }
        },
        "required": [
          "code",
          "name",
          "actor"
        ]
      }
    }
  },
  "required": [
    "domain",
    "vocabulary",
    "service_categories",
    "case_stages"
  ],
  "title": "HD-6 nội dung domain.yaml"
}
